주제,설명,활동,역할,비고,
1,미디어놀이터 체험,다양하게 마련된 2-4개의 미디어놀이터에서 아이들이 팀으로 나누어 4가지의 미디어체험을 즐긴다,1) 변화무쌍 의상방 체험,책상위에 펼쳐진 다양하고 멋진 의상들이 한쪽 벽에 우리 몸 크기로 확대되어 나타난다. 그 속으로 뛰어들어 멋진 옷이 입혀지는 모델이 되어보고 포즈도 취해 본다,60분
2,-,-,2) 으쌰으쌰 스포츠방,커다란 영상 속으로 들어가 영상 속 스포츠 선수와 함께 다양한 스포츠를 즐긴다. 다른 친구가 책상 위에서 공을 조작해 준다. 영상 속 스포츠 선수들과의 상호작용으로 감각있고 흥겨운 스포츠놀이가 된다,-
3,-,-,3) 움직이는 인체드로잉 크로키방,한사람이 영상 속으로 들어가 움직인다. 다른 사람이 움직이는 인체를 그대로 빠르게 스케치 한다. 순간의 동작을 빠르게 그려내는 재미의 발견과 아이들 간의 상호작용을 보다 극대화 하여 느낄 수 있다,-
4,-,-,4) 알록달록 색깔방,다양한 그리기 재료와 색깔들로 맘껏 그림을 그린다. 다른 친구들이 확대된 그 그림속으로 뛰어들어 여행을 떠난다. 즉흥극이 펼쳐진다,-
5,미디어 놀이기구의 이해,"비디오카메라, 빔프로젝터, 그리고 미디어 드로잉이 펼쳐지는 미디어 놀이의 기법과 시스템을 재밌고 쉬운 예를 통해 배운다",-,-,10분
6,자기만의 꿈-그림 그리기,"참여자 각자가 자신이 가고 싶은 곳, 하고 싶은 것 등 꿈의 그림을 그린다",-,-,15분
7,내가 그린 그림속으로 풍덩!,진행자들과 미디어 장비의 도움으로 각자 자기가 그린 꿈의 그림속으로 직접 뛰어 들어 그림 속 여행을 시작한다,즉흥 공연이 펼쳐지고 각자의 꿈의 이야기가 펼쳐진다. 아이들의 그림은 결과물로 전시된다,-,35분